Bahía Drake en bote(*);Desde Sierpe Transporte colectivo mínimo 4pax.; ;Todos los días;Muelle de Rio Sierpe. Tel. 2786-6534, 8815-5191, 8897-7415, 8825-8627.;1:30 hr.
Isla Chira en bote;13:30;6:00;Todos los días;Desde el Mercado central dePuntarenas; 
Playa Naranjo;6:30, 10:00, 14:30, 19:30;8:00, 12:30, 17:30, 21:00.;Todos los días;Muelle Puntarenas. CONATRAMAR Co. Tel: 2661-1069/ 2661-3834;1:00 hr.
Paquera;Horario variable según temporada. Consultar.+11:00, 16:00 solo para pasajeros.;Horario variable según temporada. Consultar.+7:30, 12:30, 14:00;Todos los días;Muelle de Puntarenas. Naviera Tambor. Tel: 2661-2084.+Paquereña, Tours a Isla Tortuga S-D;1:15 hrs
Puerto Jiménez;5:00, 10:30, 11:00, 13:45, 14:30, 16:00;6:00, 6:40, 12:30, 14:00, 15:40;Todos los días;Del muelle en Golfito;1:30 hrs
Zancudo en bote;12:00;7:00;Todos los días;Golfito;30 mts
Tortuguero (Botes);6:00, 13:30, 16.30. Teléfono Botes. 2767-6890 / 2767-6590.;6.00, 11:30, 15:00.;Todos los días;Pavona, Cariari;1:30 hrs
